{
  "eventId": "019212f3-2b1e-7c1a-9d3f-1f2a3b4c5d07",
  "eventType": "LlmFailed",
  "eventVersion": 1,
  "occurredAt": "2026-09-01T10:00:00Z",
  "aggregateType": "llm",
  "aggregateId": "6e2c5f6b-3a52-7b1e-8f2d-9c4e5a6b7c8d",
  "correlationId": "6e2c5f6b-3a52-7b1e-8f2d-9c4e5a6b7c8d",
  "causationId": "019212f3-2b1e-7c1a-9d3f-1f2a3b4c5d05",
  "producer": "llm-worker",
  "payload": { "jobId": "6e2c5f6b-3a52-7b1e-8f2d-9c4e5a6b7c8d", "provider": "openai", "model": "gpt-4o-mini", "reason": "HTTP 503 from provider", "retryable": true, "attempts": 3 }
}
